{
  "compiler_sha256": "d22cb7b3c94214261230f0b94b286d4bcfcb0bca3079807af89981b9bfeff912",
  "content_sha256": "9fa43a18450457bf209985be410abcc969c1ab06ab733f0cc7b2119aed1c0464",
  "coordinates": [
    {
      "barycentric": [
        0.2,
        0.3,
        0.5
      ],
      "face_index": 1200,
      "topology_sha256": "e0ca7ee25dc0b4c8d841bb2626e364bb88b7af7fae037e30854728842e320a18"
    },
    {
      "barycentric": [
        0.1,
        0.6,
        0.3
      ],
      "face_index": 1201,
      "topology_sha256": "e0ca7ee25dc0b4c8d841bb2626e364bb88b7af7fae037e30854728842e320a18"
    }
  ],
  "deposition": 0.7,
  "direction": "forward",
  "rest_surface_arc_length_m": 0.01,
  "schema": "tatbot.surface-curve/1",
  "source_primitive_sha256": "08554971c0d5722df1ae0e4a99e6093152da91cb8ea14ee717ffbfe48c36c8f7",
  "width_m": 0.0008
}
